doc_id,text
60,today has been pretty shitty day got so last night um went to go hook up with the guy from [redacted] so not the guy that like here and that was because i'm starting to don't know if i'm convincing myself that the guy here that like don't like me but no matter what it is is he not giving me the attention that want so it really isn't making me feel good like at all makes me feel like shit honestly but then feel bad for going and hooking up with other people just because like don't know what he thinking so think tomorrow i'm gonna talk to him and be like yo what up because really don't know what going on and if you do want relationship then in order for it to work for me we're gonna has to change some things and yeah then was doing work all day and has so much more to do all my friends went out and didn't and was texting the guy that like here and about like making plans to go out tonight basically he just ditched me he was like ditching me but well he was actively ditching me while he was texting me like not even making plans just like sort of avoiding like telling me what going on but avoiding like some acc like av-avoiding inviting me basically and then that just makes me feel like all of my friends is just going out and like has to invite myself to everything god things is just too much with people hate having to deal with people 
61,so today kinda sucked because um just woke up really sad from not being able to hang out with all my friends and from missing out on like halloween parties and stuff 'cause feel like that just like classic college-kid thing to go to that parties but didn't make it because was crying in bed so then cried little bit more when woke up but got lot of work done so got my blue sky proposal done edited paper watched two movies finished my book and am almost done with my draft for my last essay so the only thing left on my like checklist so far is to finish the essay then do my post-lab which is due on wednesday so i'm feeling good about that but um then went and talked to the guy that like here and he doesn't like me anymore so that doesn't feel good to be rejected but then also at the same time was kinda feeling like didn't really wanna date but then doesn't feel good to have somebody say that like it just doesn't like you and so 'cause still liked him so it just kind of bummer but whatever it over just feel kind of shitty in general mean what new 
62,so today was um it was actually like pretty good day told myself that was gonna be productive so finished editing my go my seminar paper finished went to the um writing center and edited my [expos] paper and then did my own edits to my qc paper so hopefully these things will get done relatively soon and don't know i've kind of just it was sunny out for some part of the day which is really nice and wasn't trying to worry about like boys or friends that much just went to lunch by myself and happened to find people so that was nice and was just kind of like living and it worked almost fell asleep in my seminar though was like nodding off which is kind of funny um finished my post-lab so today was fine i'm talking now to the guy from tufts more and like part of me feels weird because i'm sort of getting out of pesudo-relationship and i'm immediately going to something else which know that that is not really particularly healthy well maybe it not that it not it probably not healthy in the sense that like need to be interested in somebody but mean guess it healthy mean like not not healthy in the sense that just like have these other people that sort of was talking to in the past so that now i'm doing it more but whatever i'll let things play out but he does take forever to respond to me so that frustrating hate it when people take forever to text me back 
63,my day today was pretty uneventful didn't do much went to work actually work was kind of stressful because had to talk to people twice on the phone and hate doing that but it also kind of funny because said you know said to myself it actually not that bad working in the morning because nobody calls and then got calls and was like damn that sucks and then got another calls um but work is okay i'm starting to figure things out um yup um but watched some netflix today so that was nice that gave myself break and had oh also went to this one event things where got free churros and bubble tea which that was so fun it was so great and then went to rehearsal for orchestra and actually now i'm like really really looking forward to rehearsal like it getting to be point where it really fun to go which i'm really happy about um except we got music two actually might have been three two two or three songs that we have not yet played and it is going to be performed on at the concert on friday so i'm gonna have to actually go practice that so need to uh that my plan tomorrow to go practice and then also to go to like hm or someplace so that can get black button-up shirt because need one for the concert um yeah and all my essays is done it just need to be like finalized guess just go over one more time each to make sure that they're good [inaudible] the writing center for my qc one but that it so i'm not feeling too stressed and got another 25 out of 25 on my [ice] so i'm super happy about that 
64,so today was kinda sucky day um had like my normal classes and they was just kind of boring boring and feel dumb in my english classes um but submitted my expos paper and my seminar paper today and then went to the writing center and basically have to rewrite my entire essay so that is putting damper on my weekend and but good news is that got an extension until monday so have lot of time to do they which is very nice but that means this whole weekend i'm just gonna be working on they which really really sucks and at this point i'm like so confused about just the topic that don't know even if i'll be able to write good essay but we'll see and what else oh had rehearsal today that went pretty well except i'm sad that couldn't be back earlier and then still had to do little bit of homework and stuff but now i'm in bed have to wake up at 730 though to go poster for the concert for friday 
65,uh feel like all of the days now are just kind of sucking just because have to write this dumbass essay hate having to do all this work it just sucks and then don't have any time to do anything fun and like was don't even know what did today but was the most unproductive person ever it was so bad got basically nothing done um well got two readings done and an outline for my draft done oh no actually that lie got four readings done because did two in the morning but still so have to finish that draft finish the book do my pset um and then read an other stuff and then do something for expos hmm hate this like don't want the semester to be over 'cause don't want to wish my time away here but then also like want this semester to be over like want this classes to be over like the only one that actually like are uh so hard i'm so confused and i'm writing the outline for this essay and it might just be equally as terrible as the last one so we'll see how it goes hopefully it won't be that bad and also i'm just kind of like i'm lonely feel like my friends aren't hanging out with me as much and yeah and the guy from [redacted] we like didn't really have an argu well we sort of had like little bit of an argument he made me kinda feel bad but said that to him and then so he apologized but don't know can feel that can tell that he was not happy with how it ended even though he apologized but don't know kinda hate just hate things in general 
66,so today was it wasn't that bad it was just really busy just because had my orchestra concert but orchestra concert went pretty well and then went to the after-party with all of the people and it was really fun and i'm on my way back home right now um yeah men kinda suck this guy i'm going out on date with tomorrow we're going to museum but he kinda like being weird he just suck at texting which kinda suck so that like not that fun well it not but not but it just like it frustrating but don't know so i'll have to figure out really what going on really need to figure how to just be like chill and how to not uh just like guy and relationships in general i'm trying to figure out how to be in casual relationships but it cold and i'm walking back home just wanna get home so can go to bed and sleep in and then write my essay tomorrow but we're going to yes then i'm gonna go to the movie uh no no no no no no not the movie the museum we're going to the museum to [inaudible] i'm going to the museum yes um so negative it was just that was like but there um concert actually went really well but negative was that had to go to rehearsal like the whole day so that was annoying 
67,today was fine day just did lot of work but kinda woke up late was pretty productive think for the little amount of time that actually did work but ended up hooking up with guy tonight and it wasn't the guy from tufts that like am kind of going out on dates with and uh it feels just kinda like gross like really didn't need to do that and keep wondering why keep hooking up with guy and mean it definitely do it for like sense of control or something but like afterwards i'm like didn't really need that and it not that regret it it just like did actually like want it or was telling myself that did but it doesn't really matter 'cause went to party tonight and had bunch of fun with people from my entryway and still got good portion of my essay done only have two more paragraphs that need to write and oh and less than 100 pages of my book solved my pset but still can do it all by the due dates tomorrow 
68,today was good day got lot of stuff done got my set done got my essay finished and submitted and got my book finished um think like right now i'm feeling okay with my classes you know i'm kind of worried about this essay but i'm just gonna let whatever happen happen all i'm trying to get in that classes is if get then will be very happy but anyways so but went out to dinner with the guy from tufts and don't know it was weird because realized that i'm like so dependent on how other people like what guy think of me because was there and he was know that well this is just what i'm telling myself but he was like really kinda tired and out of it and think it just because he had long day but he didn't seem that happy to be there and that was it made me feel kind of like bummed that was excited to see him but he wasn't really that excited to see me it just that like like hanging out with people like that and want somebody to like me and feel like that just what get me down is when realize that somebody don't like me the way that want him to that what happened with the guy that had thing with before also need to stop just with men in general need to chill out and not like try to rebound or anything 'cause just need to take break men is just trash just hate him but need to find like way to make me happy 'cause don't know right now i'm just kinda living life just is unfortunate 
69,today was just was really tired today wasn't super productive got good amount of stuff done actually got lot of stuff done read 150 pages of of fun home which isn't due until next monday and then got some expos reading done and did my ls1a pregame the one thing though that really need to do sometime this week is read like read in full the chapters that haven't done yet so think that like four chapters so it'll be five on thursday so really need to get on that but don't know i'm really hungry right now need to go get myself some snacks and just like rearrange my life right now and like men just make me angry right now so the guy from [redacted] didn't text me today but you know it whatever i'm i'm allowed to be angry feel like hmm guy is dumb hate them wish didn't need them wish could like be happy on my own feel like tomorrow should try to meditate or do something don't know watched netflix today which was supposed to be like me time and yeah it was nice but it wasn't like wow i'm happy like need to figure out what can do that make me happy 
70,today wasn't terrible it was kind of like boring day didn't do much mean was sort of productive but uh no was fairly productive re-watched the documentary took some notes on it did response paper and then finished my book that wasn't even due until monday then after that just came home and did nothing and watched movie and then now i'm in bed it before 1100 so that'll be nice if that i'll be able to get like almost 10 hours of sleep wow that will be so nice and think the rest of the week i'm gonna start working hard on like my my research paper for [inaudible] so can get that stuff done and out of the way and then i'll have like ample time to work on my research thing for qc um so don't know nothing like great happened today but was kind of just like unhappy not that was sad in general like sad about something it was just that wasn't happy about anything which is kind of bummer and don't really know how to fix that um but have my lab tomorrow so get to see my lab partner it he kind of weird i'm not sure what he think about me but kind of wanna hang out with him and see like what he like um but it weird and need to stop like worrying too much about boys think i'll like let whatever happen happen but i'm not gonna put energy into anything at the moment feel like i'm starting to stress just gotta like let go that that what i'm gonna do 
71,today was relatively okay guess was productive did some homework but it wasn't like as much as wanted it to be and feel like just right now with my [inaudible] research in general just have so much stuff that just need to read through and figure out if need it or not 'cause right now i'm just kind of like sort of like skimming through things but not actually finding any like where i'm like uh that quote that really should use it like don't know it just just need to sift through things now like sit down and read everything [inaudible] have and then figure out what have wh and then what need from there so think tomorrow that what my focus should be and god really need to start studying for my mid-term that on tuesday and don't want to and hate mid-term uh so i'll have to stay for that and make like cheat sheet which won't be fun and yeah not fun at all nothing good will come from that so that will suck hopefully won't get shitty grade on that one um god i'm just stressing like today wasn't sad again it was just that wasn't happy and mean went out and did some fun things but feel like it all just temporary whenever go out and do something fun then later feel bad because didn't spend my time working and hate just like going to bed every single night thinking that could have done some other work or having more could still be done but mean that happens that it always gonna happens but think like once [inaudible] is over and that won't be as bad 
72,today has been um actually really productive day got ton of research stuff done and got my psat done and went to the library and met with the librarian and we found lot of good stuff got some books so now all i've read five articles that could possibly use has one more that need to read and then few chapters from some books and then other than that the day has been fine um don't has to go to work tomorrow which is really nice but i'm just kinda stressed out now lot because of my midterm which is not fun and i'm not happy that i'm gonna be stressed out for my birthday weekend and i'm going to the harvard-yale game and just got like my housing assignment thing but it with bunch of black guys and black men is usually not um accommodating to gay people so we'll see how that go also i'm the whitest black people know and it hard to interact with other black people and that just like whole nother sense-of-self-image problems that has but has so i'm thinking has one more articles could possibly read it now and then go to bed after that or go to bed now and then read it tomorrow feel like part of me should just say read now and then go to bed so can get it out of the way 'cause i'm gonna probably wake up at around the same time so just get that and then might as well sleep in for as long as want get up eat read i'm gonna or maybe should read my books right now maybe i'm gonna read some of [eleven] for like 45 minutes see if can zoom through that probably what i'm gonna do my god my face is so greasy feel like my fingers is just so dirty [feels just] dirty maybe i'll take shower 
73,okay so my day was like okay it wasn't even that long just did lot of work went started my day kinda late but got most of my research done and like got lot of reading done got solid like 120 pages of my book read so that good um so don't have like that much need to do tomorrow but went out tonight and now i'm really tired and this is also why i'm doing this very late and had good time and made out with some some guy and that was fun it made me feel good but you know i'm not even gonna try to focus on the the even think about the bad stuff i'm only gonna think about the good stuff yeah so hopefully tomorrow can be more productive but then it kind of bad was just really tired all day and i'm sure that that comes just with like every long day is like it just like really tired and um there was this guy that danced with and he was really trying to make out and didn't really want to and didn't and was like wow self-control and also making this boy practice how to be consensual and not force himself on people is good um but then my friend was feeling sad which made me kinda sad but not sad like as and he was bringing me down but was like damn wish could help him feel better that kinda sad but we had good talk so hopefully he'll feel better tomorrow 
74,so today well during the day it was well kinda fine it wasn't super productive got good amount of reading done but still need to do like solid 100 more pages that also need to study for [inaudible] would suck because have midterm soon but i'm not happy about that um but good news is is that went to dinner with some of my friends for my birthday dinner even though my birthday tomorrow which is still tec-technically today 'cause it past midnight so it is the 12th so yes happy birthday me but yeah went to this one party and it was really fun wanted to dance with this one guy but he didn't dance with me which made me sad but it okay guess i'm little sad but it doesn't really matter now i'm just really tired i'm kinda stressed about the midterm 'cause feel like i'm not going to do well at all which is not going to be good so we'll just see how everything goes 
75,so today was my birthday and it was very uneventful birthday think it just because like one had my birthday dinner last night so that was like my celebration with my friends and um then tonight like today everybody was so busy with homework that barely saw anybody went to [inaudible] with two of my friends and then just did homework by myself in the library and um and after lunch just stayed stayed in the library until went to dinner wow my day was really was uneventful but think it was just mix of like not seeing my friends and none of my presents from my parents had arrived yet [that] it didn't really feel like my birthday so was just kinda sad because nobody could like hang out or make today special but then my my friends came it surprised me it came like two-ish hours ago and it brought me cookie cake and some presents so that was really nice um and so i'm really happy about that and then face-timed my other friends from the [home] for long time and miss them i'm so excited to see them so that'll be good um and [i don't know] uh it was just kind of boring day got all my homework done but have my midterm on tuesday and i'm not excited about that like i'm really worried and really stressed out but uh [but] [inaudible] we'll see how it goes 
76,so today was um today was okay didn't really do much got my first present came and it was hydro flasks and was so happy about that now that have water bottle again can start drinking water and [inaudible] skin and got my [inaudible] done and finished reading all my [inaudible] sources um and got my research question or my sort of research question figured out um for the for my [inaudible] class so today was actually pretty productive um it was just and boring like nothing really happened was little sad it was kind of lonely and [redacted] are stressing me out like yeah it just stressful don't even know why it stressful it just like going traveling but have school work also realized that during thanksgiving break i'm probably gonna be lonely because nobody even gonna be on campus so i'll have to see which ones of my friends stay here don't even know how like food are gonna work like if the dining halls are open 
77,so today was all right went to work that was fine and took my midterm and the midterm was okay just one question that kind of worried about mean know did it right it was just i'd got like by looking at the graph i'd got different number than what lot of other people was saying so don't know we'll see if [people get personal] points for that but god i'm so angry because did response paper that was i've worked on it yesterday finished it yesterday it was due today at 1159 pm and forgot but didn't submit it and so [inaudible] i'm so angry because well [really how] we're able to get an extension of one day an extension for one thing and emailed him saying that would like to use it but the only problem is is that you have to like send that email before the actual like due date time so but sent screenshot of like the finder window that says that this thing was finished in time so would you al see [that] so maybe you'd make an exception for that but maybe not but it just so irritating because then like your grade goes down like one one personal letter grade so in order for so the best grade that can get on that would now be an minus and i'm so angry hmm because know could do well on that paper because really like my topic oh god hate life and hate it when do dumb thing 
78,so today um today was actually okay it was pretty productive um actually no the best thing ever happened in class basically um in my queer [inaudible] class to sum it up spoke in class but gave some like information that nobody even noticed before so we was working on fun home the comic book by alison bechdel and there was like some incidence when it was talking about like death and how the images can be used to um describe how she feeling about death without actually using the words and then so the the strip that it was talking about that we was talking about in class was when she was in record store and then it was flipping through the record and the only record that had it name visible was schubert um string quarter no 14 which was like oh hey that death and the maiden so then told told them and was like yo this is just one more example of how the images is is portraying this through even another media that that doesn't even use words that could portray how somebody is like coming to terms with death because death and the maiden is is maiden dance with death so it like she is kinda figuring out what death is so felt like so good and my professor was like wow di [laughter] she was like oh can't remember what she said she was like pulling out highbrow um uh something highbrow realization or doesn't know was like [inaudible] so that was that was great and then also so today was pretty productive finished my essay well on top of all my class um finished my essay did little bit of research read 40 pages in my book and um 40 pages in my book actually more it was probably [inaudible] yeah it was [inaudible] and um finished my essay read book did some research and finished my proposal my research proposal so then that good so now all have to do for friday is um the intro for my research paper for [expos] so that'll be so then i'll do that have lot to do this weekend which is not fun have so much to do every single weekend why is my life like this god hope pick easier class next semester 
79,today was all right um it wasn't that productive it was just really slow day got my [inaudible] thing done so that good um so everything that due friday is now finished also realized that didn't have to read my book until not this upcoming monday but the following monday so i'm not doing that until this week next weekend so then that means only have to do my psat and then some theory reading for um [inaudible] so my homework for the weekend is actually almost done like could probably i'll probably work on my psat tomorrow for bit but i'm not gonna do that much so that like pretty exciting um yeah other than that it was just kind of boring day i'm still trying to figure out if this guy in my [inaudible] is gay or not i'm so confused but asked my lab partner to hang out so we're gonna hang out soon which is great because he really cool 
