doc_id,text
174,um today woke up um me and the rest of the outfield and the team and our outfield coach went to breakfast it was super good and then we had good talk then after that went back to our room and took nap for like probably like 1000 am to 100 pm and then got up ate really small lunch then went to practice had practice until 600 it was good though it was good practice today and then there was like team really underprivileged team from the bronx that came in and we did some drills with them like young girls like middle school girls so that was fun then went to dinner with some of our team did little bit of work went back to our room did more work and i'm about to go to our friend room and hopefully watch some olympics because we're on like week two of the olympics and i've watched none of it pretty sad so really like winter sports um like snowboarding haven't been in like year but miss that and let see our first class isn't until 1100 tomorrow so can sleep and then and we leave on thursday for orlando and that'll be our whole week just today or not today but tomorrow wednesday thursday and then we'll be gone friday so i'll have to make up class but it shouldn't be too bad just have one class on friday but do have to make up test and that it 
175,today um last night stayed in my friend room and today woke up when he had to leave and then woke up again few hours later for my classes um and then went to classes and then stayed for some extra reviewing with my teacher and then went by grabbed some lunch came back to my room for minute um and then after that went to practice had practice um got to go outside today it was so beautiful and then we had team meeting and then we had lift and then went to dinner with my team and then after that came back to my room and i've been working up until now and now need to go to sleep 'cause need to get up and go eat breakfast and study some in the morning 'cause have quiz in my first classes so that what my day looking like it was pretty good 
176,today was so busy so woke up went to breakfast studied went to my first class took quiz went to my next class right after and then um so one of my really good friends that was below me his mom died last night so um woke up to text from him so then spent some time with him through the middle of the day um he actually gotten to be one of my really good friends here so that was really upsetting um but he back home now so hopefully everything going okay there or you know as okay as it can possibly be um let see after spent time with him had class to go to and then had another class after that and then came back to my room actually rearranged my room today and did work for little bit went to dinner with one of my teammates came back to my room did some more work um went to study break for like few minutes and then went to meeting with one of the clubs i'm in and it more work here um went to cvs got some snacks came back to my room took shower talked to one of my friends from home on the phone um got few things together because we're leaving tomorrow for [redacted] florida to plan my first tournament and so i'm super excited get to play against some of my friends and get to see my mom and dad because they're flying down so it should be really great weekend i'm excited 
177,today woke up um went to cla no actually went to breakfast and then went to two classes had and quiz and test and then went back to my room packed did some work and then went to the locker room did some more work ate some food then we got on the bus went to the airport um ate dinner there got on my flight came to florida and we just got to my hotel room and we have to be up early so need to sleep but today went pretty fast and pretty good day that about it 
178,um today woke up and ate breakfast and then let see oh we played two games today got two wins surely good time we went to eat got to see my mom and dad they brought me snacks and shirt and some like random stuff but missed them lot so they was really good to see them um now i'm just in the hotel with my teammates they good time my games are until like the afternoon tomorrow so that good and um let see i'll see my parents again in the morning so that fun think i'm gonna go to sleep [inaudible] because i'm tired but yeah that was my day did not work but that was my day 
180,today woke up and we had to wake up really early because our game was 900 am and so we went to the park played our game lost but only by one run and it was really really close the whole time and then um after that we went back to the hotel showered got our stuff together coach took us to ice cream then we went to the airport got our stuff through came back to campus one of our teammates had like an asthma attack on the plane so our coach sent us with her straight to the health services when we got back and got back to our room from staying with her not that long ago and i've been doing homework but i'm about to be done and go to bed because i'm super tired i'm just gonna get up early in the morning and try and finish an stuff but that was our day really good weekend had lot of fun had good time 
181,today got up went to breakfast studied for quiz and then went to my classes and then came back to my room and was getting headache so instead of going to my 100 to 400 lecture took nap and got up did some work um went to check on two of my teammates that are sick and then did work from like 600 pm to midnight went back in my room um might watch little bit of tv and go to sleep but really need to wake up early to do some more work and slept lot today but i'm still tired so think should probably sleep soon too um aside from that don't know i'm pretty tired from the plane ride back yesterday guess or two days ago whenever sunday um can tell season are gonna be really hard to keep up with classes and everything have so much to do and like not enough time but it fine 
182,today woke up early did ton of work and then went to all my classes went to practice went to dinner with my teammates and then came back to my room and wrote an essay and let see um my really bright purple shampoo with toner in it and really it really pigmented and really thick it busted in my softball travel bag it got all over lot of my stuff um so that was pain in the ass but think it gonna be okay and let see have so much work to do before we leave thursday and tomorrow wednesday and everything is flying by so fast and i'm so tired but i'm gonna watch um an of spirited away on my computer till go to sleep so that was my day 
183,today woke and um sound really bad think i'm getting sick didn't feel that good this morning but feel little bit better now um let see got up went to my class oh i'm finished some homework and made breakfast in my room and then um went to class and had class pretty much all day did some homework in the middle of the day and then um almost fell asleep in my last class but made it through had meeting about paper wrote um with one of my tfs and came back to my room for little bit and had like date with harvard law guy tonight which don't really know how feel about that because one he like four years older than me but it was really nice had fun and now i'm back in my room and i'm gonna watch some tv and go to sleep 
184,today woke up and had okay woke up at like 600 and went to cvs and got some stuff and then um ate breakfast with the class and then um studied had quiz in my second class and then after that oh had to go pack and then did some extra work and then left and my first flight was um to [redacted] and then from there we came to north carolina so we just got to my hotel and we've literally been traveling since like 300 pm this afternoon but we're finally here i'm super tired like slept on the floor of the airport so um that about it 
185,today woke up had breakfast and then let see what did we do oh um our team went to eat lunch then after that we went to the field we warmed up um then we played two games we lost the first one we beat unc the second games which is awesome um 'cause that something like we're not projected to do and then came back or actually went we went to get dinner and then um came back to the hotel our parents and our sister is here so got to see them and talk to them um i'm losing our voice so sorry if you can't hear me don't have much of voice right now but spent some time with our family and now i'm gonna go to bed and that was our day 
186,um today woke up pretty early for me and then ate breakfast and got ready for our game and then so we went and played game um it was really close loss it was four to three and after that we came back to the hotel had lunch um and then hung out with our parents and our sister for while then did some homework and then um we went to dinner as team and then came back and i've been doing more work ever since but got to eat tonight with our mom our dad and our sister so that was really good um and then so we have one more game tomorrow and then we go back to [redacted] i'm just trying to do some work and study for our midterms little bit but um that was pretty much our day um pretty pretty standard 
187,um today got up pretty early ate breakfast and then got ready for our games packed all our stuff up we loaded up before we went to the field got to the field [inaudible] played got beat but got hit in the head with pitch today so hard it knocked our helmet off and caught me in the back of the head and got really dizzy so it checked me for concussion um might have slight concussion but go to the doctor tomorrow to find out so our day really really sucked um yeah literally just came back from an injury i'm gonna be really upset if actually do have concussion because that would be literally like that would just crush me actually um and then we got to the airport we were on the same flight as two baseball teams so our plane were really rowdy have midterm tomorrow that i'm gonna have to wake up early and cram the study for and i'm just now getting back to our room and that were our day 
188,today woke up and went to breakfast uh went and took actually studied at breakfast for like two hours and then went to take my midterm it was really hard um went to my next class didn't go to lunch came back to my room went to go see the doctor about my head um do have concussion it very mild i'm really really mad about it it not great um so hopefully this whole thing over with fast just came back to my room and tried to do work did get some stuff done today but um guess should be resting so i'm just gonna rest now and that was my day 
189,today woke up and went to eat breakfast ate with my team um took an interview speaking midterm today in japanese and went to lunch with one of my teammates and then went across the river and while everybody else was at practice had to go check in with the doctor about my concussion and so basically they looked at me and then told me to go back across the river to my room and to rest so went back to my room took long nap got up made an soup in my dorm for dinner and then um i've been trying to study and do an work but they just taking me so long and can't really concentrate um the doctor had me email my professors about what going on and i've been advised to just skip all my classes for the rest of the week but i'm trying to go to an that are really work heavy so don't get behind um right now i'm still trying to do work and they just really hard to concentrate that was my day 
190,today woke up well last night stayed in friend room and woke up and he was actually sleeping on the floor he gave me the bed well he started out sleeping next to me and then woke up and he was on the floor probably [inaudible] didn't want to wake me up um concussions suck felt better today than did yesterday but still feel just kinda weird um went to one cla one and half classes today did some work went to lunch with one of my teammates um tomorrow or actually today is housing day so need to go to sleep so can find out my house in the morning [inaudible] on yesterday went to recording thing for one of my classes had to record podcast and then went to starbucks for little bit with one of my teammates and then went to meeting for club i'm in then went to one of my teammates room and just hung out for while and came back to my room and did some homework and then packed for california 'cause i'm leaving for california tomorrow and that was my day 
191,um today got up and it was housing day and my group got um well first we was like one of the last group and then um we ended up getting cabot which is in the quad so everyone was really sad one of my teammates cried um but like honestly it won't be that bad because like an extremely unusual number of athletes got the quad this year so mean we'll have fun out there we'll have good group and then after that uh packed everything and was on plane for six hours and now we're in california and now i'm about to go to sleep because i'm really tired um need to talk to my mom and dad but like really wasn't as exciting as thought today was gonna be just because of the outcome but you know it part of life so it fine 
192,um today woke up went to breakfast and then um let see we had two games today got [two] [inaudible] started concussion rehab today so it lot of like visual um exercises and like balance things and then tonight after dinner um got to get on elliptical for 10 minutes to see how felt felt really good so this is really good news because wanna play really soon um officially on spring break it my first day in california love it lot the weather beautiful and there no humidity which is super cool and then let see what else have lot of work to do over this week but um should have the time to do it so it shouldn't be too bad uh um that about it so yeah anyway team playing cards now so that my day 
193,today we played one game and won and then it rained so our next game was rained out and then um we came back to the hotel [redacted] family took me out with them for the day so we went to go see stuff and um went to eat at the cheesecake factory it was super good and then came back to the hotel and i'm so tired now i'm i'm ready for bed um yeah but other than that that all have to say about today i'm just really tired i'm really really tired um and yeah we're like about to have team meeting just to make sure everybody back in here but then um that was our day 
194,um today woke up and oh we had to be up super early today because we had game and then so we played that we lost so it was like kinda raining all morning and then we went to lunch at this mexican place came back to the hotel took showers relaxed for little bit and then um retook my impact concussion test and redid my balance test so hopefully i'll be cleared soon because wanna play again and don't wanna have to deal with this concussion anymore and then for dinner we went to one of my teammates' houses and um it had food and we played game and then we went to the beach to watch the sunset it was really really nice and then we came back to the hotel and we're probably gonna go to bed soon because everyone really tired but tomorrow my free off day so it should be pretty nice 
195,um today got up got to sleep in and then we went to like the [redacted] boardwalk and walked around some and um went down to the beach little bit and then went to eat lunch and then we came back oh had really good coffee this morning too at some place called blue butterfly um anyway then we came back to the hotel took nap and then ran on the treadmill for like 15 minutes as part of my concussion rehab so that was really good and then passed out feel fine so hopefully i'm about done with this mess and can get back to like playing and working out and everything um we played some cards think we're gonna play cards again and then probably go to bed because we have to get up early again tomorrow but um that really it 
196,today woke up and had breakfast and then we drove like an hour to the riverside to play two games um we won the first one lost the second one right after that we took showers the teammates and went to one of my teammates houses for dinner um which was really good really good time they have really cute dogs and then we came back to the hotel and i've been doing an homework and uh uh got an done i'm trying to online shop little bit but i'm not really finding anything like um we go back to [redacted] tomorrow they been snowing lot there so we'll see how that go um uh that was my day well yeah they was that was really pretty much everything they went really really fast 
197,um today we woke up early ate breakfast went to the airport got checked in um played cards while we waited for our flight and we were on six-hour plane ride back and we got back to [redacted] and then um we all basically went to eat dinner so weird thing happened at dinner we were getting ready to leave and this older guy comes up to our table and asks if he can sit down so we told him we're about to leave and then the waiter comes over and asks if we know him and we're like no and then he makes big scene and starts yelling and asking like why we would say something like that um then he tried to take our bags to act like he were carrying him to the door for us and that were really weird so we just took our bags back and tried to get out of there as fast as possible but he followed us so we dipped into starbucks and waited and he eventually left and so us and [inaudible] other um freshmen who were with us we like ran back to the yard to our rooms and unpacked and did some laundry and i've been going through music um facetimed some of our friends from home and i've been looking for birthday present for our dad yeah that were our day 
198,i'm gonna do this little bit early because i'm getting kinda tired um woke up this morning made breakfast in my room studied little bit and then went to practice passed my last physical test to be cleared of my concussion so finally free and then after that did some light recovery stuff like uh stretching things like that and then so the the last physical test is really hard it five miles on some airdyne bike under 14 minutes and then it followed by full lift so you have to get through it and you have to stay com or yeah you have to stay symptom-free so it was pretty rough test and then after that went to ramen with two of my teammates for dinner and then we got ice cream came back to my room put away some laundry and now need to um get together what need for the weekend but yeah that was my day 
199,um today woke up did work for about an hour then went back to sleep then went to practice and then guess it was my first practice back being cleared after my concussion so that was good and oh after that went to dinner with two of my teammates then we went and got ice cream and then came back to my room and we've just been hanging out then we're gonna sleep soon because we have to be up early to go to [redacted] to start my conference which is super exciting hmm let see what did do tonight oh we worked on an of the getting an of the photos together for my [senior senior] night and we wrote my psych notes for tomorrow which was just like nice notes to my teammates before we play um but yeah that was my day 
200,today woke up and uh went to [inaudible] unpack my stuff and then let see we went to [redacted] played two games um we won both and then came back to the hotel called my dad because it his birthday today and uh just talked to him for while 'cause had pretty rough day just personally and um let see we ate dinner now i'm trying to do some studying but i'm really tired so i'm probably just gonna go to be soon and we play one more games against [redacted] tomorrow and then we go home so yeah that was my day spring break almost over so that sad have class again monday but that about it 
201,today woke up and then had breakfast and we played our last game [inaudible] and we got beat seven nothing it was pretty ugly um then we changed and stuff and we got on the bus came home um well not home but you know back to school and i've been studying for midterm have tomorrow ever since then and went to review session from 830 to 1000 so that was like right in the middle of our night but now it almost midnight i'm super tired so [you know] just quit studying for the night and go to bed i'll i'll try to get up in the morning and do some more but [inaudible] for school right now i'm just tired of school things going on i'm just tired 
202,today woke up and went to breakfast and studied for my midterm had today and then went to japanese and then went to uh my lecture after that but have uh another hour to study for my midterm and then went to take that felt pretty good because i've literally studied so much for it and really tried to cover everything could but it was so hard and i'm really scared didn't do well on it um but it over now so you know what can you do and then took nap after that then went to dinner went to the library did some work with one of my friends and then went to cvs and got some snacks and then one of my friends came over to my room and we talked for while and he just left so i'm about to go to sleep but that was my day 
203,today woke up and went to class well first went to breakfast and did some work tried to study and then went to class and then came back to my room did some more work um and then like took really short nap then had to go to practice and had practice and lift today it pretty extensive it was actually pretty long time and then um let see oh wrote some entire essay after got back to my room in japanese so that done in advance and now i'm watching some college softball on my laptop and have practice really early in the morning again so i'll probably go to sleep soon but that was my day it was pretty decent 
204,um today had to wake up early to go to practice and then after that me and one of my teammates have class with went to get coffee and then went to class um had another class right after that and then went to lunch with different one of my teammates and then um let see what else happened oh then um had another class and then had two-hour lecture and oh then we had meeting tonight uh for the club i'm in and we had one of the faculty members there tonight to talk to which was really cool he was really fun and then oh that meeting are always good time then came back to my room and now i'm probably gonna go to sleep soon and that was my day 
205,today woke up and thought would go to breakfast but then um was lying in my bed and decided that just didn't really wanna go so made oatmeal in my room for breakfast this morning which was really good too and then went to two classes and then had office hours and went to then went to practice and then we had lift and went to dinner with one of my teammates and then we went to the battle for yord fest thing which was actually super cool and some really good kids performed and found out that little [redacted] is coming to perform for yard fest which is also pretty cool um and then came back to my room did some homework watched uk and uh kansas state play basketball uk lost so that sucks um went to study break for little break came back tried to do some more work and now i'm just relaxing and that was my day 
206,today got up and um had class from 900 to 1200 straight with no breaks so that kinda sucked but after that went and got some food and went to my room and relaxed and uh took really nice nap and went to dinner with couple of my friends and then me and some of the girls that i'm rooming with next year went into [redacted] and we went to ghiradelli chocolate store for uh dessert and then we went to watch movie then we came back to [redacted] and hung out in their dorm there was party in another room so we partied with lot of football players and then we went out to different house to party with some of the wrestlers too and uh it was pretty good time uh we can't drink because we're in season but it was still really fun good fun group of people that was my day 
207,today woke up and um let see what did do had to oh pick up some food for the bus ride to [redacted] and then went to eat breakfast myself um then we had practice and then after that we all got on the bus and we've been on the bus for like six hours coming to [redacted] and then we stopped for dinner and to get coffee sorry and then so we finally made it then we had like short meeting with our coaches and now we're just like in our rooms listening to music and doing little bit of work i'm gonna try to get up early to do some more work you couldn't really do much on the bus it was kind of bumpy ride and then the bus didn't have wi-fi for some reason but overall pretty good day seemed really short now that look back at it but that was about it 
208,today woke up and ate breakfast and um oh did some work this morning and then we got ready for our game played one game today and then came back to the hotel had meeting ate dinner had another meeting and then [inaudible] been relaxing i've been trying to do some homework um talked to our parents on the phone twice today talked to our sister on the phone today and have lot of work due tuesday and we're missing all of class tomorrow so trying to get everything done um but that was it 
