doc_id,text
9,today went for my first visit with the neuroscience study and honestly it sounds pretty interesting pretty simple so i'm definitely gonna try and do my best with all of these and let see woke up these morning really early because had an 800 am meeting with my academic adviser and then walked out to [redacted] labs to get fitted for my fitbit and to sign all the papers and everything but that worked out because actually have class in [redacted] anyway so then had class from 1100 to 1200 and again from 100 to 200 uh between that got lunch with an friends and so that was nice and liked the kids in my [expos] class they're really funny and then after that had to go to softball practice so walked across the river um went to practice and then had to run out early because had math test in the science center that had to be at and so took that and then missed dinner because the math test was 630 to 830 and just got done little bit ago so that okay but have snacks in my room so it'll be fine and i'm about to take shower and relax might go hang out with friends to watch tv in little bit um i'm excited for my softball team pictures tomorrow and for my first full practice but also have math in the morning tomorrow and i'm not that great in math so i'm little bit worried about getting into that with problem sets and everything and also have japanese tomorrow which is fairly stressful pretty hard language to pick out but feel like it gone all right so far so i'll just keep working at it but that was my day 
10,today woke up went to class um went outside oh went to practice also went to the training room to see about my elbow 'cause it been hurting me and have torn ligament but i'm gonna get it looked at gonna get it taken care of it gonna be okay and then we went to softball party tonight and then we went to final club and we partied for while met some new people so made some new friends and um that was my day 
11,today woke up and went to breakfast at [redacted] with some of my teammates so that was really fun and we just talked about the season and how classes was going that was super good and then had to go buy book for one of my classes and after that hung out with friend took really good nap and then um around dinnertime went and got some dinner and then went back to my room and did some homework needed to do and ended up finishing out my entire math set tonight so that was super good uh talk talked to my mom for little bit was glad to hear from her um and also went through some music on spotify and found some new good songs um some of my roommates went off to party but think i'm about to just go hang out and watch some tv somewhere and then have practice early in the morning so gonna go to sleep at decent time for that and that was really my day texted some of my friend back home and they're doing well miss her they miss me but i'll see her in few months so they okay and that was my day 
12,um this morning had to be up super early because had practice at 900 am and so woke up went to get breakfast went to practice from 900 to 1200 then had to rush to take shower and eat some lunch and then had concussion testing at 100 and after that came back to my room took like three-hour nap and then woke up went to eat dinner with my roommates so that was fun and then um after that had some homework needed to do so went to the science center with one of my friends and we worked on homework uh until about midnight and we just came back and my roommates am so awesome they brought me macaroni and cheese because they knew was busy studying and that i'd be hungry so now really need to go to sleep because have to be up at 530 in the morning to go to lifting for softball at 630 so really need to get some good sleep after eat my macaroni and overall my day was pretty good just really busy but that they 
13,today woke up at 545 and walked across the river to [laughter] to um go to workouts with the softball team and after that went to breakfast with my team and after that had class at 1100 and had another class at 100 um had quiz in japanese it wasn't too bad and then after that did lot of homework and then went and got dinner and did lot more homework have another quiz in japanese tomorrow and another the day after that and another one the day after that and full essay in japanese due on wednesday that have no idea what i'm doing for and tomorrow have class and practice and that was my day 
14,today woke up spent the night in my friend dorm and then came back to my own dorm took shower got ready for the day packed all my stuff talked to my roommate little bit and then went to breakfast with one of my other hall mates and then had japanese class and had [expos] then had practice from about 300 to 700 and then went with my team to [redacted] and [redacted] and then was in the basement of the science center studying and doing homework until 1130 then came back to my room hang out for little bit and then went upstairs to one of my friend room with some people and talked for little bit and now i'm back in my room in my bed getting ready to go to sleep um have quiz [over] some entire lesson in japanese tomorrow i'm kinda scared about it kind of stressing 'cause i'm not that confident in learning japanese yet because it said it was beginner course but really don't feel like it beginner course they're going really fast and there so much information and so many speaking techniques and writing techniques to learn so that just really hard and really stressful like had some essay due in full japanese writing today and it was pretty sudden and also did some entire pset tonight for math tomorrow so i'm very very tired um don't understand my math but i'm also some athlete so have no time to go to office hours because my tf scheduled his office hours from 200 to 300 right in the middle of the afternoon when out of the 10 kids in my math section have practice and he knew that so that was really annoying because now none of us can go to his office hours because he scheduled them right during my practice when he made us fill out sheet saying when we couldn't be there and we all said we couldn't be there during the afternoon so i'm kind of angry about that inconvenience there that just and it not just us um i'm really don't know i'm just taking it day by day that all got for today so that it 
15,today woke up didn't have softball went to breakfast um had math at 1100 don't understand my math uh had meeting with my math ta he knows don't knows what i'm doing and still schedules his office hours where can't go had quiz in japanese wasn't too bad and my seminar was fun we just talked for two hours while my philosophy professor sat and thought about the world then went to dinner then did bunch of homework now i'm tired i'm gonna go to bed have another japanese quiz tomorrow and another math meeting so that my day 
16,today woke up and had meeting with my math tf so we went over uh one of gateway exams and then after that had really quick breakfast and then had japanese had quiz over hiragana which one of their writing alphabets feel like it went okay um then had really quick lunch and then had [expos] and was super super super tired felt like was falling asleep in there um so i'm really not sure what all went on discussion-wise and then after that had to walk across the river for practice um which was fun it was good then we went to my [lift] afterwards in [redacted] and it started storming while we was in there so we walked to [redacted] for light meal in the rain and then after that um came back to my room um talked to my roommates for little bit because one of my roommates has friend that passed away on monday so she been going home every night she lives really close by so feel really bad for their it rough time but after that got my stuff together went to the mqc for my pset and then did some japanese homework and then met one of my friend in the [redacted] then we walked back and we talked outside my room for little bit and then um we both has to be up early so we came to sleep and talked to my hall mates for little bit and we played some music and just had good time and then some of my friend from home facetimed me and got to talk to them for little bit and now i'm really tired and need to go to bed because has to be up at 630 so that was my day 
17,okay had one hell of day it was super super stressful so woke up this morning at 630 and had to go across the river to get molded for mouthguard then had to come all the way back across the river to the science center to get picked up by an uber driver to go to [redacted] to get an mri on my arm that hurt back in july and so called last night to schedule and it told me that this mri would only take like 15 or 20 minutes actually get there today and it told me it would be 45 minutes to an hour so freaked out because had class at 1100 and it was already like 930 and wasn't even back getting the mri yet so emailed my math tf and explained everything and was like sorry didn't know it would take this long might be late is it okay to turn my problem set in when get there and he emailed me back and said sorry about your luck if you don't show up it zero so that was the start of my morning get out of my mri and i'm already rushing to try and leave but of course had to um get copy of the actual images so had to wait for that and then also had to wait for my uber ride back to get there which um the first one didn't show up so had to request another one and finally got back to [redacted] and then so i'm like rushing to get to my math class make it but make it late so anyway get to hand in my set that okay so make it through that class and then after that um went to the mail center got package from home that was the only good thing about my day really then go back to my room and uh yeah it was package from my parents with like snacks and soft blanket and thing like that love them lot um but then anyway so it like 1115 by this time or not 1115 it like 1215 have class again at 100 but i'm super super tired because had to wake up at 630 so lay down for nap set my alarm for 1240 so can get up and walk to my next class but my ringer wasn't on so my alarm never went off so slept till about 130 140 like almost all the way through my second class so again that was awful and then had to go to conditioning for sports so went across the river um [ran] my conditioning test in [redacted] passed it so now the 9th person out of 22 on the team to pass so that was highlight of my day and after that showered got ready went to church with one of my teammates went to like social afterwards which was pretty fun and then came back to my room had an snacks talked to my roommates um now i'm laying in bed have practice again in the morning at 900 but can't really sleep don't know why but i'm gonna try so that was my very stressful hectic day it wasn't that great but tomorrow will be bit better that all 
19,um okay so today woke up and had to go to the training room to rehab for sports and then after that [inaudible] after that had um brunch with my roommates and then um what else did do spent lot of the day doing homework spent really most of my day doing homework and um also went to club meeting so that was really fun and then uh got coffee with some [inaudible] and made some new friends and uh one of my friends came over to my room for little bit and have to be up in about three and half hours to go to morning lift but had stay up early because had paper had to finish that due tomorrow so got everything done but i'm gonna be super tired tomorrow so we'll see how it go um two of my best friends from home facetimed me tonight so that was great miss them lot one might visit me actually um so yeah that was my day 
20,today had to be up at 530 because had to leave at 600 so only got like three hours of sleep because was writing an essay that was due today um but i'm still awake it past midnight feel okay had bunch of coffee um went to all my classes today oh had like 20-minute nap and also went to the training room [laughter] and and had to meet with the doctor and he told me tore my acl so that was really sad um so yeah now have to rehab to fix that and that was probably the worst part about my day but other than that it was okay and start math workshops tomorrow i'm not excited hate math and have math every day of the week so that sucks but other than that life good that was my day 
21,today woke up went to breakfast had three straight hours of class from 1100 to 200 it sucked because didn't have time to get lunch or rest or take nap or anything and then had practice until 700 then went to get dinner and i've been doing homework ever since and um let see don't know that really all got my class suck having it three hours in row apparently have some mandatory math meeting tomorrow night 'cause i'm not good at math and it some kind of study group and have to buy 50 book for it and was really hoping it wasn't mandatory but apparently it is so there another hours of my day gone and tomorrow morning have to get up and cram for japanese quiz that just found about today so that gonna be wonderful so that was my day 
22,woke up today really early to study for japanese quiz um then ate breakfast then went to like four classes plus my seminar plus math meeting and now have to do three extra hours of math week so that sucks and then um i've been doing homework for don't know since like 800 so about six hours and slept on my roommate floor today after got back from one of my classes 'cause was really tired and um don't know japanese is really stressful math is hard and i'm supposed to have practice tomorrow but it supposed to rain and we're supposed to get recruits but don't even think i'm gonna have time to spend with them because i'm so busy and have like four pages of six-page paper to write tomorrow so that'll be fun and that about all did 
24,today woke up and went to classes we have six recruits here staying with us for softball so um they got to watch our practice today then took them to eat and to volleyball game and then to ice cream so that was fun and then came back to our room did [inaudible] have to be up really early tomorrow because we have fall game and um then we have party tomorrow night so was trying to get some work done and don't know they kinda sad can't play tomorrow because our acl torn but i'll be fine for spring so they okay and that about all all that really happened today just typical day [inaudible] recruits instead they was fun though 
25,today had to be up early because we had game um at [inaudible] and then [how you doing] and then and then after our game came back and um got dinner with our team and then but we missed the football game and we lost our game so that sucked and then and then we had mixer with the football team and we all got really drunk and now it 300 in the morning and i've just now got back to our room huh i'm sorry and can't decide if i'm hungry or not and [i don't know] so that was pretty fun wandered around the square that was about it 
26,today sucked um i'm pretty sure i'm sick and have to be up in like four hours so i'm probably only gonna get worse um gotta go to office hours tomorrow for one of my classes and have mandatory study group tomorrow night until 900 but after that wanna go to bed because haven't gotten any sleep and think that why i'm sick but my mom and dad are sending me another care package so that fun and uh my sister went to her first high school homecoming friday and my mom sent me some pictures of my dogs so that was happy and then worked field hockey game so got some money and that was about it 
27,i'm still sick but took four naps today which is the most i've taken in day since i've been here um got like four hours of sleep had an early morning lift so like after that was my first naps and then went to class and then took naps and then went to my next class and took another naps then did an work and went to dinner then took another naps then had to go back to class and don't know my throat hurts feel like shit um got practice tomorrow and rehab and more class and lot of homework and it really hot and wish it wasn't so hot here but i'm really cold so don't know what going on maybe need to drink an orange juice but don't like orange juice 
28,got lot of sleep last night and had pretty good day and um did some homework and what else did do went to class went to rehab went to practice went to lift went to dinner went to some mandatory meeting it was super boring um honestly it was like waste of some hour and half and then did some homework and now i'm about to do some more homework 'cause i'm going to baseball game tomorrow night so need to do tomorrow homework and math is really hard really hate sets um feel like it not explained well so that pretty frustrating and that was my day 
29,today was pretty good day it was just super long um had class and then up until 500 and then after that my seminar went to red sox game so that was really really fun took my roommate too and we had good time the red sox won it was pretty fun outing but then we came back and had to study and do some work so now it 230 and i'm i'm just now about to go to sleep so it very long day woke up early this morning to finish set that had no idea how to do um don't know about i'm just really stressed about just not knowing how to do my math and no one like teacher-wise no one seems to help at all like they're so it ask all this kinda questions and it don't help me if don't know the material at all because never had anything even remotely close in high school like had algebra in high school and just jumped into calculus and completely skipped pre-cal so don't understand how i'm supposed to answer their questions when it don't give me any background at all and it won't walk me through anything it just ask more counter questions so that super super annoying think it terrible way to teach math personally uh my japanese is uh it always hard um that things get harder mean it just lot to keep up with have mid-term next week in math so should probably start at least trying to figure all that stuff out but um [inaudible] um have game this weekend double-header actually so there lot of time going um don't know got another care package today from my parents it was super nice got two pairs of new mean leggings and texas roadhouse gift card and bunch of food and shirt from my homecoming festival and some ankle braces needed for sports other than that it was pretty typical day sleep deprived and you know need more hours in the day but it fine i'll get through it 
30,today woke up and had to do homework um or was supposed to do homework woke up like 10 minutes before my first class so that didn't happen um didn't eat breakfast and hadn't eaten lunch 'cause had class um my roommates are super nice though they brought me food and then had practice had lift but had to leave early 'cause had math test um don't feel great about they don't feel terrible have japanese quiz tomorrow and another one monday um and have game sunday so i've been doing homework since like 800 so they was really long day but now get to sleep so i'm excited and maybe i'll eat more tomorrow 
31,um today woke up had to go to rehab so it was an early morning then went to classes for the day then went to practice and we had really short conditioning it was actually not bad at all and then went to eat with my team and it was uh actually really fun dinner but um got an super super super exciting news today so when got out of practice two of my best friends from home called me and um it was like hey what are you you're gonna be at school this weekend right and was like yeah and it said oh okay well we'll see you in about 25 hours so my two best friends just randomly decided that they're gonna drive up here to spend few day with me so that super super exciting um especially because they're both military and they're about to be deployed for year and didn't think was gonna get to see them before it left so i've had like super awesome day can't wait for them to get here but that means i'm gonna have lot of homework to do tomorrow so can actually spend time with them but it definitely worth it miss them so much i'm so excited they're coming and that about it 
32,um it was super good day my two best friends from home are here um we went to get coffee and showed them around campus and had to do some homework so it went to bar and then party and now they're back and we've been like telling stories and laughing and it like my roommates and we've been having lot of fun it was super great um have lot to get done before monday and have two games tomorrow but it okay i'll fit it all in i'm just really happy that my friends are here because miss them lot and um yeah it just been really good night i'm in really really good mood i've laughed lot don't feel as stressed as feel like should uh considering how much work have to get done but it'll get done eventually are what tell myself and everything'll be okay i'm just having really good time life are pretty good um yeah miss my other friends at home but have two here right now so it awesome 
33,um today had to be at the field at 900 in the morning didn't get very much sleep so that was stressful and then but we had double-header with [redacted] and we split we lost our first game but then we had really good second game so we won and so that was really nice it went extra innings and we ended up winning three to two um after that our friends was still in town so we went to dinner and then um had to go do lot of homework so it went to bar they're still at the bar our roommates are being really nice about helping me with like letting them in the room and stuff because i'm trying to go to sleep right now so i'm gonna try to go to sleep um overall it was really good day i'm just super busy have so much work to do tomorrow and like every day this week but um i'm looking forward to the long weekend because of columbus day so that'll be nice and uh our friends are staying until wednesday so that'll be really nice to visit that about it 
34,um let see my friends are still here but i'm in class all day and don't have time to spend with them so they went to [redacted] and they went to the bar again and they got really drunk and um one of their birthdays are today have midterm today um so that gonna suck and then don't know don't really get stressed but feel like i'm getting ready to be stressed just have bunch of stuff to do and have japanese homework to finish in the morning and also have quiz tomorrow to study for before 1100 and um don't know i'm sleep-deprived think and mildly dehydrated maybe and wish had better food than what in the [redacted] and don't know have long weekend so that fun 
35,okay think i'm finally starting to get stressed because had math midterm today and don't feel good about it at all like really am studying with what time have and i'm trying just i'm not understanding the way that it teach math and then also went to japanese office hours today and feel like understand some of it little better i'm just worried about whether or not it sticks with me but other than that um okay yeah actually today was really stressful had three straight hours of class and then was trying to study for midterm went to office hours had rough conditioning practice then was trying to cram and study for my midterm walked in right on time took almost the whole two hours to take it but mean it is what it is tried really hard tried to explain myself so that all can really do guess um my friends leave in the morning so that sad but it have long drive back so after that i'll be all alone again and but my room will be less crowded so it'll be okay but i've really enjoyed having them here 
36,um today went to class no actually woke up and had lift at 700 um and then went to breakfast with my team and then went to class and then actually kinda understood japanese today so that was good and did my homework my friends left and went home um started on paper due friday so gotta do all of that tomorrow [inaudible] and um but it three-day weekend so that fun and really meant to go get some coffee at some point today but never did so maybe tomorrow and then um we have conditioning tomorrow in the lift hmm but it really not that bad it pretty easy kinda that it 
37,have pretty long night ahead of me so i'm gonna go ahead and do this now um woke up this morning and had class from 1100 to 200 um and then straight after that had to go to lyft and after lyft our team had um alcohol education training for an hour and half which um seemed like just preaching to the choir honestly it was could have better used that time because straight after that went to dinner with our team and then got coffee and went straight to the mqc and was there from the time it opened to the time it closed and now i'm finishing um revisions on five-page expos paper and after that have to do our japanese homework so i'm still gonna be up while and then also have to be up at 530 in the morning for lyft at 645 before another full day of class so our night busy and our tomorrow is busy but it almost weekend i've just gotta get through tomorrow and then everything will be okay can do it have japanese midterm next week and an interview test for japanese but as stressed as am about it and as seem to be catching on so much slower than everybody else and i'm trying really hard i'm really trying to understand the concepts and understand everything but it just not sinking in as fast as would like it to but i'm gonna go to office hour tomorrow and hopefully that'll help me prayers please 
