doc_id,text
211,so today um it was not the best again this week just isn't great woke up was sad um wasn't excited to go to gov 10 now i'm even more stressed out just because don't wanna like participate in that um debate thing that we have to do tomorrow so that was stressing me out also had to sit with all of my track dude friends this morning for breakfast even though wanted to eat alone but one of them sat down and then the rest swarmed was like all right great and um also one of my friends from my blocking group she like in the class with me and we was both like obviously irritated with the whole situation so that was like kind of [comfortable] and saw my other friends in my blocking group and was still angry at them didn't really wanna see them was actually on the phone my sister then talking about them because was angry and every time tell anybody they're like what the fuck that just dumb that they're acting that way so don't know what really going on and had my orchestra dress rehearsal tonight it went all right except one girl fell so that not the best and i'm probably only gonna be able to go to ballet for like don't know 30-ish minutes because call time at 715 so maybe won't go to no i'm gonna stop by for just little bit um let me think afam was terrible also because my friends from my blocking group was there basically just wanted to be alone the whole time um so but yeah all in all life is not going very well but am walking to go spend the night with this one senior dude that have been talking to so hopefully that will go well and make me feel better 
212,today was uh don't even know why wh how to describe today um it was kind of nice guess with my seminar my seminar is like such fun place to be in my professor like called on me and it wasn't anything bad at all it was just like you know don't really know well it not that do know what going on in my class it just kind of feel dumb because i'm the only freshman and then there is like four grad students or i'm lied there is three grad students hmm one no there is four there is four grad students and three undergrads so just feel like dumb person um but need to need to like stop i'm drunk right now and had really great talk okay so no that another thing is had my orchestra concert today and then afterwards there was reception where there was some like alcohol and shit so my friend and we stole [laughter] three bottles of alcohol of like wine and then she came back over and we was like drinking we drank bottles of wine and started talking um so now i'm very drunk um well not very drunk but i'm i'm pretty drunk and um we had like lot of good conversations about just like not only orchestra but then also just about like her and culture and how everyone like so so concerned about like her profession and grades and it really did make me feel like that stuff don't really matter that much and know it don't matter that much but just need like somebody else to like within [redacted] community to tell me that and so i'm very happy that we was able to have these conversations that we that we had tonight and that like had really great time with her um and then also just like came to terms with the fact that like spending the night with with that guy that was with last night the only person that like spending the night with was the guy from [redacted] who went to see so know i'm drunk right now so drunk person is her real selves so maybe that means that wanted to be in relationship with him yeah know except he did he like still not the best at texting me which feel like if we're going to have long-distance relationship you have to be somewhat good at at texting not just like he 100 you have to be responding every second it just like if something warrants response or not even warrants response but uh response would be expected then he should respond but he don't do it all the time 
213,today was pretty chill day woke up was still drunk which kind of fucking sucked um and then was just kind of like doing my own thing went cop breakfast saw my friend then went back home and did some writing got 10 pa wrote wrote 10 full pages plus little bit on some eighth pages today which is lot and i'm very very satisfied with that and then also did little bit of reading but think the rest of the weekend is just mainly gonna be reading probably doing little bit of writing so i'm very happy about that um didn't actually see that many people but called the guy from [redacted] we had nice hour-long chat and also called the guy from new york and we had we had good chat too um and was supposed to go out on date with that senior dude who go to [redacted] but then was like you know what don't really want that too so we ended up not going out which i'm happy with but then went out because one of my girls' senior friend was like hey come to this party there bunch of gays so we did and then just like made new friend with this one black dude um and we went to like another party and then we went to grill to go eat and yeah had good time um and it was just kind of like chill day you know didn't talk too many people didn't see many people was okay with it because it was like hungover the whole day it was happy but didn't have to deal with anything 
214,today was pretty chill day um woke up got ready did some reading got finished all my gov 10 reading for monday finished all my afam reading for monday did little bit wrote like one more page so now all have to do for the weekend is read the souls of black folk which i'm not gonna do all of i'm just gonna read like some of it um at least 100 page though i'm gonna get 100 page done um and read the souls of black folk and then just do little bit more writing think four more page is doable because then just like get in the groove of doing the research part of well mean i'm [inaudible] interaction but didn't really interact with any people during the day like went to lunch and who did eat lunch with oh yeah ate lunch with some of my friends from my blocking group um and we kind of had talk about life in the blocking group and how we're just little worried because things is like starting to we're starting to move further apart but then one of the other girls in my blocking group um texted me and she was like hey wanna come get some lunch with me and my cousin she in town and so went with them didn't actually like get any food just got drink but [inaudible] to talk to people um and then had my orchestra concert again tonight and it was not like the it wasn't great the brass section really not good so that kind of some issue um but yeah it was pretty chill day barely talked to anybody which it was nice to do that and but it was super nice outside 
215,so today um kind of [inaudible] day didn't do much really didn't talk to many people at all went to brunch with two of my blocking mates and one cousin for like an hour so it was good but then did lot of reading read like hundred and 100 pages of my book so only have 30 more left and it due thursday so that good that don't have that much to do in that class and then did lot of writing just now read wrote probably um oh wait let see oh wrote five pages five pages double-spaced yeah uh let let say four wrote four pages double-spaced um which is pretty good um but kind of wanted it to be wrapped up by now but it not so think have like little bit more that need to add for [inaudible] but that don't really matter um uh just got back my mcb midterm and got an [81] so not too happy about that so it just means that really need to work harder on everything else um guess maybe i'm just student because that all that really is only get bs in in things which just need to be okay with guess um but went to [redacted] to eat with um this one junior so that same people went to brunch with came and ate with us um she really cool and really like her but don't think one of the other girls in the blocking group like her but you know what whatever [inaudible] to her own uh so now just wanna go back and go to sleep and not do anything but i'm glad that we only have four more weeks of school 
216,so today was actually pretty good day um like don't know it started off as good got little bad got good again got little bad but it got good again um woke up went to breakfast saw couple of my friends but was really kind of feeling out of it was um little sad not sad but just kind of like confused about what how to think about this whole situation with the guy from amherst because was texting him last night before went to bed and he was like yeah i'm probably gonna come out [inaudible] this weekend we're trying to figure out car so that we can get there um so like that but it was ju-just weird because he wasn't giving me like definitive answers and wanna be like wait so which day was you gonna come are you gonna stay with me assumed that he would be staying with me but was gonna be like [inaudible] make sure uh what night are you staying uh blah blah blah blah but then he don't know he just he text it not that he text weird it just like i'm don't think he like texting so he just don't isn't like very great at communicating but anyways so whatever um but [yu di do di do] gov 10 political theories sucked [inaudible] it was good lecture but then at lunch was like poop i'm feeling kind of sad just because of like gov 10 feel like i'm dumb all of the goo normal stuff with with gov 10 but then we got my paper prompts and one of the prompts was literally the essay that the like the essay proposal that gave to my tf when was ins um office hours just being like hey are would this be something that would work for future essay and it was literally the exact question um so don't know maybe he was looking after me maybe i'm just so clairvoyant but we don't whatever who cares um so that felt good but then went to work and love my coworkers they're so great just being able to talk to him about everything that going on especially just with this amherst dude and then comparing it to stuff with the tufts dude [ugh] but it it convinced me don't put ins lot of work into this amherst dude because long distance are hard especially if you start him long distance like it it just probably don't invest especially money or emotion so and if it can't communicate well then you know that [it just not gonna] go well so yeah um but then went to this um queer people of color thing like spa day um and that was really really good and then also finished chapter two so now only have chapter three and the epilogue to do i'm so happy 
217,um today started off as really really good day just woke up and went to work was hap was happy um and then got like to lunch and my friend was like come eat lunch with me so then did but she was at table with bunch of people that didn't know and she ended up like didn't even talk to her that much and then when did she was talking to her about one of the guys that matched with on tinder and she was like no he not gay and i'm like what are you talking about so um that was kind of frustrating but then oh went to go talk to the [inaudible] people about the whole thing with the the dude that i'm having issues with and she was like oh yeah well we don't really do mediated meetings so probably not gonna deal with her anymore um and saw him walking home from that meetings actually smiled at me and reactively smiled back but then was like fuck just want to get out of here uh and then went to orchestra had great time came back just finished up some reading did little blog post um edited both chapters that need to edit and then also uh but then people in my blocking group texted about like some [cumba] thing she was just being so obnoxious and was like all right well guess we're going to be rude today for no apparent reason we didn't have to then talked to this other girl in my blocking group and she was like yeah they're really just this are just unnecessary so just do not disturb that chat i'm not going to do that i'm just not even gonna pay attention to that anymore i'm just gonna like let it die cause people are just being obnoxious in it um yeah i'm trying not to let that get to me this are gonna be good week i'm not going to let something dumb ruin it i'm saying no to bullshit 
218,today was great day um so got up went to breakfast with this one dude that was talking to on tinder for little bit um he like kinda cool but i'm not interested in him was just like excited that could go out to breakfast with somebody which was nice and then went to office hours for my gov 10 tf and we like talked through my paper and he was like yeah this is great do this this and this he like helped me so know what i'm doing for that which is awesome i'm so happy about that um and then went to my lectures got to eat lunch by myself bought myself some ramen watched some netflix and it was really nice to be able to like chill and step back from everything and not have to worry about anything and then went to my mcb lectures it was pretty good lectures and then went to um my and then went to the gym for little bit so did some squats and some chest flies which was great and then went to romance languages dinner thing with one of my block mates and we had really great time and it was really cool and some intellectual space came back did some work was working on my gov 10 paper because don't have anything that due tomorrow or anytime soon so was like you know what we're just gonna think ahead so have two out of the seven pages done um and then i'll probably do little bit more tomorrow definitely wanna get at least five pages done by the end of friday feel like um feel feel like 100 draft done by the end of saturday without doubt um and then went called the amherst dude we talked on the phone for solid 30 minutes which was really fun i'm glad that could catch up with him and then went to one of my friend rooms with like down the hall from me and we had wine night so that [where i] was like doing my writing and we was talking and it was it was good time yeah today was good day it was really good day think was kind of missing out on was kind of sad like about few thing just with the guy who didn't like message me back on tinder and one of my friend got [prepunched] and i'm going to the event with her but was sad that didn't get [prepunched] by anybody but you know what it fine it don't really matter that much um but i'm excited for this weekend and i'm excited that all of this stuff is getting done yeah 
219,so today started off started out as great day um was just feeling happy it was really sunny out but then don't know things have been not that they've been going downhill it just that it kind of like there been slight um just it been slight descent guess um just went to my seminar class and don't know people keep talking and that just kinda makes me feel dumb just because i'm the only freshman it like freshman seniors and then there freshman two seniors and then four grad students so don't really feel feel definitely feel like the outlier who just like kind of there giving like not very substantial claims don't know it really feel really weird came there to give the emotional side of things and that the only things that can really contribute or that feel like can contribute and then like don't know didn't see that many people texting my my blocking group have been texting in the group chat again and and that just seem that kind of frustrated me for some reason even though it don't need to um went to ballet and was also like kind of not really liking it which was weird that the only time that that happened um yeah don't know it was weird day it wasn't like there was anything bad there just wasn't anything really that great um and don't know not many feel like nothing really worth explaining with mean it okay so like went to breakfast with my one friend this other dude that like me was there and so it was kinda could tell that he was that he felt awkward um that he felt nervous um and then went to class and then went to lunch with my friend had halal which was delicious um and and then we went to the library and did some research um for one of my final projects and then what did do after that and then went to [gov] section and that just didn't talk much but was like you know well don't really wanna talk much so didn't said like three things which mean that fine yeah i'm don't know it just right now feel like kinda weird and went over to my neighbor room and he was like come and hang out with me and so was like okay so went over there but then there was lot of people so then got stressed out and it was all drunk and so was like i'm gonna go 
220,today um don't know it was weird day it was like kind of good but then also kind of not great just was doing lot of homework oh did went to one of my professor office hours and um we talked about my novella that i'm writing and like techniques of how should be doing that like what what the best way to write this especially since mine is non-linear timeline like how am gonna make sure that it all flows and works and then the and then we also had good talk about like what it means to [reach hope] in class um which was kind of like an interesting thing just when um talking about race like it was really and then she emailed me afterwards and she was like yeah um this is this article that was thinking of after we finished my talk and it was really good talk so was like hmm that it made me feel good that she also thought that it was like good intellectual conversation guess which is always nice to hear that somebody else thinks that too um but [inaudible] is coming tomorrow which i'm very excited about that also my blast out-of-orbit performance for my orchestra and ballet thing um but basically actually no um don't know didn't see that many people today felt kind of lonely though um and also kind of bad for myself but don't really know why thinks it was just the weather oh had an interview for summer job though that thinks went pretty well i'm not entirely sure though i'm just really critical of myself my knee hurts but did finish dov draft of my gov paper so maybe when sunday night i'll go sunday night or monday night i'll go to the writing center thinks it open on sunday night but maybe it not but then monday night i'll go to the writing center and just have them like read it over and just wanna make sure that like my theses kind of travels and that the conclusion also make sense with with the paper 'cause uh this i'm gonna make this good paper this is gonna be i'm gonna get good grade on this um but just have ton of reading to do have to read two books for one class the other and they're long books too one is 300 pages one is like 150 pages so they're both due on thursday kind of stressed but you know what reading for other class just might not get done and you know what that okay 
221,so today started off as kind of like stressful day just because had to wake up early and then go to my orchestra like creative team thing but it was kinda fun to go to that just because um it fun to it like funny time where we're writing scripts so um yeah that was enjoyable and um actually contributed to some thing but then just did like little bit of work only some hour of homework and it was kind of sad but then did like my performance and striking the set um and then the guy from [redacted] came and he here now he in my room and we're about to go to bed but we went to um uh [pop's] with the orchestra um after-party it was like it was fun and i'm glad went and wish we could've stayed longer but then we met up with his friends that was here and got kind of like stressed out and don't forgot to take my medication today so i've been feeling kinda weird i've been disassociating lot where would just like stop like focusing stop like understanding where am and stuff and what i'm actually doing like i'm saying something and i'm like am actually saying the right words or am calling somebody the right name just kind of don't know thing like thing like that um yeah don't know it was weird feel weird right now 
222,so today was um it was pretty good day woke up and um said goodbye to the guy who spent the night and we ended up hooking up last night um which was like actually having sex was was really nice um and then did some homework so finished reading my book and finished all my gov reading and did little bit of essay editing yeah um it was pretty productive day like was working all day and did some writing too but um oh also went shopping with one of my friends and that was nice then went to brunch went to brunch with one of my friends she junior and um we had great time like it was we had really good talk about um school next year and like what need to be thinking about doing and then like my relationship life and hers and so it was good like mutual conversation and love having that where can have somebody who can listen to me but then also somebody who comfortable talking to me about talking with me about all of the like important things that are going on in their life and then we went to fashion show today which was super fun and yeah i've just been doing lot of lot of work but it was really fun was with my blockmates for the fashion show and it was like one of that time when we all get together that we know like why we like to hang out with each other 
223,so my day today was pretty normal feel like um wanna just kind of put moderate for everything basically like had some good things um had some good convos with my friends and stuff um but keep forgetting to call my parents and wanted to call my mom today but just didn't have any time which really kind of sucked um but actually did this really fun things so my friends is ves concentrator so they was making um movie things and they came over they was like [redacted] need you to comb bunch of coconut oil through your hair so they came over and we did that for little bit um but gave my gov 10 paper to one of my friends to edit which they was like they really good paper um and only gave me like few things to do like fixing couple of confusing sentences so i'm pretty i'm feeling pretty good about that so we'll see how the actual peer-reviewer um tackles that um but today was they was pretty productive which is great 
224,so today was actually not really the best day um woke up was extremely tired my stomach really hurt so didn't eat that much for breakfast and then went to work and one of my coworkers was really really irritating me she um we all have like the same job and basically the main thing that we do is answer the emails so get there like couple like 30 minutes late because was sick and she like not doing anything she just sitting with her homework and then say like pull up the emails box i'm like can you help me with some of these emails and she like oh just checked before and there weren't any and i'm like there is 12 emails here and you decided to not do any of that and then was like whatever and then she was like oh yeah guess i'll help and then i'm like doing my shit and then look over and she just staring at the same page it just so irritating when people don't actually fucking do anything that they're supposed to do while i'm actually working and then these other woman who work in the office she was like the one who interviewed me at the very beginning know that that woman don't like me and don't like her either frankly because she is rude as shit she do not talk to people in way that she deserve she very curt and can tell that she is all friends with everybody else in the office except for me and it like noticeable that she treats me differently [i would say she's] rude to me she short and she like ignores me and i'm i'm just really kind of irritated with that job in general right now and it just today i'm just so i'm extremely irritable today and then went to orchestra and was tired and everyone was being so loud and not listening not being productive and it was that was also really irritating me and then i'm like okay everything better i'm going to these one party it like pre-punch party thing with one of my friends and like that was fun going to the um to the whichamajig to the pregame and like talking to people and met some really cool girls and also sort of kind of like not really flirting but sort of flirting with these one dude who was pretty cool um and then we go to like the actual club where the party is and one of my friends she like let me buy you drink so i'm like okay i'm taking the drink and i'm drinking the drink and then some people comes and it like um you're not 21 and she kick me out of the party so then now i'm here back at home irrita 
