doc_id,text
141,so today was fine um went out to dinner with my parents for the last time um while we're here so it was nice and we had good food um and hung out with my friend and we had good time we watched westworld and went to his hot tub which was really it was just nice time also started new book i'm almost done with that it only like it non-fiction like collection of essays but it only 84 pages so really isn't that diff well it little it kind of difficult but it it just doesn't take that long um was feeling like generally oh also had to go get my passport my new passport which was really stressful for some reason um but other than that generally felt okay got to call the guy from boston so that was nice that we could talk um but everything else was normal guess was kind of little sad by the end of the day just because my one friend was telling me about computer science class he taking where he like logs all of the words in horror stories to try to see what words in what progressions like make writing scary got kind of like pissed just because was like well see how that like take lot of thought and stuff but it the wrong kind of thought when you're analyzing this kind of english because it not just like mechanical comparisons feel like they're they're the overall the overall parts that give you the feeling and like understand that that parts it could just search for them but then without the original analytic thought like the actual good stuff stuff that was true interpretation then you wouldn't even have basis for that and like to what extent is every single words giving that meaning there have to be so many different words that that give book feeling like that so doesn't know and then that triggered something weird but it was just me feeling lonely and that needed somebody to talk to but i'm back and and i'm about to go to sleep so feel better 
142,so today was my last full day at home and it was pretty uneventful day just did laundry finished my book watched some tv did some piano um you know it was kinda like [inaudible] day didn't talk to many people conversations weren't that long i'm really really didn't do anything 'cause it kind of slowly went by quickly feel like like in the moment felt like so bored like it was just moving so slowly but then now lying in bed i'm like this day went by really quickly am little sad that i'm leaving well i'm just sad that i'm leaving my family and stuff my bed am really excited to go back to school and hang out with all of my friends and not only to start my new classes but then like the ballet classes i'm really hoping that this will be transformative semester for me not just emotionally but also physically like with the classes hopefully that'll just make me more active and i'm don't think i'm biting off more than can chew right now think i'm just loading myself up with with stuff that it not particularly it like set amount of stuff per week so like with ballet that don't come home with work that don't come home with mentor that only like maybe max three hours week once have two mentees and have zero right now so that the only thing that i'm like not stressed guess i'm keeping it in the back of my mind and decided to apply to that inter one of the internships just because if get it then can decide if wanna fly home or not or can see if can modify the dates but if can't do any of that then i'll just decline that instead say something came up 
143,so i'm back at [redacted] and i'm so happy that i'm here got to see few of my friends which was really great um and the plane rides was okay was actually like really bummed because [redacted] again wasn't texting me like don't know why it was stressing me out so much and hope that now that i'm here it not gonna be that big of deal but think like with that the guy who who goes to school here if he 'cause he keeps ignoring me so if he don't change that we're seriously gonna have problem and it not to the point where it like me being crazy person where have to have him text me constantly it like he just opening multiple messages and not responding with like just don't know and it really frustrating know he like not ignoring or know that he not like mad at me or trying to ghost me or anything but it really frustrating when he does that so don't know we'll goes out [inaudible] date with him and see how it goes but if it gonna keeps being like this i'm just gonna say no 'cause i'm i'm not gonna put myself through that and so like was getting stressed out before and was like you know what i'm gonna talk to different guy right now because don't need to really make that big of deal out of this right now don't need that in my life 
144,had pretty good today day today um it was really fun got to see all my friends again it all came back so we all hung out and like went to dinner and went to breakfast and it was the women march today so that was like really good we didn't actually like march it was just rally but it was nice to go to that um it was really goo saw lot of friends and it was great to catch up with them all um and hooked up with this one dude and was like we was talking lot and we was having great convo it was great we started making out and stuff and then um like he finished but was hard before but then for some reason just lost it and don't know what happened and don't know i'm like feel like everybody gets slightly embarrassed and kind of am but also don't really care but als only sort of care because i'm like hope he don't feel weird about it hope he don't like feel like oh don't like them anymore because he couldn't gets hard or whatever but we was like hey you wanna go for little walk like it was 10-minute walk it wasn't anything um afterwards feel like we could do something after hookup then like definitely makes it not awkward because if that was kind of awkward mean it only awkward if you makes it awkward and so don't know we'll see if he texts me back well mean said had fun time thanks for going for walk and he was like did too and though i'm the walk was nice and then said good night so don't know we'll see if um if he texts me or i'll probably texts them again sometime later and be like hey you wanna just go gets some coffee do something tame and if things am looking up then sure it just weird don't like ending things on weird notes like that not saying that this is over but mean hope that it not over would like to go out to coffee with them some other time don't know feel kinda bad for like making them stay up later though just because he was like oh-- whenever we was finished he was like yeah have to gets up at 830 was like oh sorry did that so don't know i'll be like hey hope it wasn't too bad how about oh that smart how about buy you coffee to makes it up yeah smooth that what i'll do and if not then who care don't have to buy somebody coffee just no the one things is like gossip 'cause don't want that to gets out mean mean don't care mean do sort of care but really don't think it just things at the moment that kind of care it like kind of 
145,so had really really really great day today saw all my friends went out to family brunch and it was so great and then there was some other friends there too so we was there for like two hours just having fun and it was lot of fun and then saw one of my other friends in my entryway and we act like pi we played piano together and it was it was really nice and then worked on my cover letter so felt like was being productive and hung out with some more friends and we was all together and then we went to track meet to see one of my friends like don't know she was like sort of interested in him but it was kind of like weird but it was nice to just like do something with with people and then went and saw my other friends who just got back and we caught up and it was great and love her so much and then went out on like date with this dude where we went and we got dinner and we walked ar-around downtown lot and it was so much fun and then we went back to his apartment and we tried to watch movie but we was just talking the whole time we drank lot and we had lot of fun and he really fun guy and um and then he kissed he like came back to my dorm and he like kissed me goodnight which was so cute and it was great so don't know re-downloaded tinder because i'm dumb people because my friends matched with some dude that was really cute who had no idea was gay so then was trying to like trying to match with him too and still haven't [inaudible] and know need to delete it so at some point this week will delete it um but i'll see that guy again on thursday which will be really nice and he he he really cute he really funny and like him the only problem is that he lives far away and don't really have the funds to go out on like date with him all the time so the only problem with like dating somebody who don't go to [redacted] is can't just be like come over and chill with me or like watch movie or watch some tv or just like let go do homework together like can't really do that it not like the distance isn't really great for that so i'll like if things develop i'll have to talk to him about like what we're really gonna do because don't wanna have to spend money every single time we go out on date 
146,so today started off fine it started off as good day woke up at like 900 and took my time and took nice long shower and then went to breakfast then hang out with bunch of old friends then went to my first [inaudible] class and it was really cool but then um got then went to lunch and things started going downhill so my stomach started hurting managed to shove down all my food after like an hour but didn't even didn't finish all of it but it was like almost all gone so was like okay i'm just gonna just call it day and then um went back home and did like little bit of meditation which was nice went to work and worked 100 to 400 and actually had great time like talked to bunch of people [again] there this new dude that was kinda helping and was chatting with him lot and he was nice oh and he so gay too it so funny um but the um the good day at work was all just trick because the ballet registration came on while was at work and when got off and off of work and then went to go on to the registration page it was all full my class was already all full and the first people on the waiting list which means that like somebody just did uh don't even know how many people are registered it sucks like [inaudible] and then was just talking to bunch of people and started feeling bad then started feeling bad about my body and stuff just because like everybody else are working out and now my like one motivation to actually do it are gone um but i'm gonna go tomorrow morning and morning workout sucks but i'm just gonna have to do it so i'm gonna go to be like now was gonna go to bed earlier but then just took forever um and then was sad because that guy that had things with before but it ended badly um it didn't end badly but it just ended badly for me like was just kinda left in the dirt which really sucks and was just treated shitly and it wasn't fair for me and that kind of like what i've conclu-conclusion but anyways it was his surprise birthday party for me and all my friends was talking about it and was like damn this are just bringing back all of my bad memories and shit and like try to joke about it and be fun with it but it it it still sucks but this other guy that kinda like now means he really nice dude there are an things about him where i'm like that not my favorite well it just like an things that he talks about but really don't care it like it things where we we can actually have conver like good conversation about it but it not something where it like deal breaker it like we have the same thoughts about lot of stuff but then we differ on like little tiny things about this big things so it kind of good that can still have good discussion where we will have different opinions but that it won't be that bad but means he out with his friends right now and i'm alone and sad 
147,so today was like halfway good day halfway bad day started off good woke up early and worked out with my friend we went to like total body circuit and workout video not workout video workout class which felt really good after um and then had nice and easy time at work um let see what else else would be god the professor is looks to be irritating um but with african american lives in the law that class is gonna be really really really difficult but it'll be think it'll be really cool so i'm gonna take it um and let see what else um orchestra was good but by dinnertime started feeling like really really bad for some reason think it was just because like started thinking about that guy that we've been hanging out with more and we'd tried we both tried to call each other like three time but neither of us could pick up at at the time so it was weird because today we like texted lot more than usual but it still wasn't lot so it made us feel don't know kinda weird that just in comparison to the rest of the time that we're talking like it not very much so don't know if things keep going with him or i'll talk to him about it but think at this what i've been telling myself is to not talk about him with like friend or something because then just end up stressing out because just relive it every single time talk about it so i'm only talking about like guy with one friend so hopefully that'll be good um but then also worked out again went to the gym we was lifting with one of my other friend at like 900 and did not do much like homework and stuff but none of don't have anything due had reading due tomorrow and finished it but all the rest of my stuff is for tuesday or and then guess monday monday and tuesday so we'll see how everything goes 
148,so today was one of the worst days ever um woke up and went to woke up and re got two emails one from the seminar professor and she just said hi [redacted] thanks for the emails i'm glad you're [dropping] the class [redacted] and so that basically means nothing maybe either it means nothing or it that might uh say that my little thing no it probably just means that i'm not gonna get another class like that but the emails did nothing for my case then got another emails from the ls 1b people saying that cannot do the overlapping enrolment so then that means can't do african american [inaudible] so i'm going to instead take an afam literature class tomorrow morning and also realized have to do ps11 to do orgo so can't do orgo next year so i'll have to wait until junior year do that which in not ret what what the opposite of retrospect futurespect don't know and looking ahead that might be better for my case just not really knowing if wanna do med school so i'm kind of like really evening out all of my requirements throughout all four year so then that way would be applying either for gap year or have two gap year and do job which that might be nice that would actually probably be preferred um but let see what else um um went to the circadian rhythm class which was good but now i'm just thinking like what do do with all of these class and lecture means discussion how do fit them all in so that can also work so that really stressing me out is finding time to do all that shit have to do these all by friday and don't really know what to do so i'm really kinda stressing out by really means super stressing out and then they're like oh you have to do these thing to sign up for section by friday but we can't do that yet for ls 1b so have to talk to my friends to see how to do that but you know everything is not going well and on top of that the guy that like he have barely talked to me today and is it so hard why is that so hard don't understand it really just don't know what to do and i'm don't want to vent to my friends because don't want to be annoying about it and constantly harp on the same thing over and over again but then just like ruminate on but i'm ruminating on it no matter what it just so frustrating 
149,so uh today was also shitty day probably shittier than yesterday so for this past week the thing that i've been looking forward to was that was going to hang out with the guy that went out with last sunday and was probably going to spend the night but wake up to text of him saying that he can't do it because one of his friends from new hampshire is gonna come to town so that means that can't hang out with him and this is the second time that he has canceled and on top of that he still sucks at replying to me so all of my friends has told me to cut him out and think will just do not know why has guy even come to me acting like he want to be in relationship and then he treat me like shit like do just has something about me that says treat me like shit fuck with me is that really what people see that he that that is okay that that what want him to do but re-downloaded tinder and that helped boost my ego and went to the seminar that wanna get into there was like 40 people that shopped it and only is gonna be let in and this one annoying girl was kissing ass so she probably is gonna get in even though she doesn't really deserve it so great this is just great 
150,so had really great night tonight my friends fro my friends from home who goes to [inaudible] um came to visit and we had like really great night we went out we didn't actually goes to any parties but we like [inaudible] with bunch of friends and we had like really really fun time and actually like met some new friends and almost hooked up with this one dude like it was close to establishing but it didn't happen but that was okay had really fun time and registered for classes so it good that like that shit is all figured out um and went to see therapist today so i'm still bummed about the guy who kinda went out before and it might be that he just like really busy but you know don't care i'm talking to other guy and it fun to talk to other guy so mean right now i'm feeling really good and sleep well it like [inaudible] but you know whatever so yeah 
151,so today had like an amazing day woke up and was super happy and went to this like public service conference and was like feeling so good just about like that what wanna do wanna do something where i'm like with people in public service or do like legal service or something or even like public health um and it also made me realize that don't wanna be premed anymore so finally just pulled the trigger and dropped ls 1b i'm taking pol political theory class instead and my life already feels so much better like none of my friends think of me as premed it only they're like you it notice that hate all my premed class and that don't enjoy them and that i'm am trying to skirt around taking them all so it like like the idea of being doctor and like learning science but don't wanna actually like do the intro bio or do chemistry or do physics or even do like calculus anymore don't don't wanna do that so just i'm i'm done and feels like this is good like it good change for me and don't know i'm kinda lonely right now i'm kinda lonely wish that have like somebody that could could be in relationship with but there nothing can really do about that mean could be interested in somebody but can't actually force anybody to be in relationship with me so there that but it okay 
152,um today was it was like only work it was only doing homework just because had to catch up with the reading for my um political theory class and the reading are hard but um it it wasn't that bad like had lot was reading all day but um it was manageable so that good that that was like week worth of stuff for only one weekend um but i'm going to definitely be way more productive this semester so know have um some reading that due thursday um have four nights for it so i'm gonna get going maybe even do some reading tomorrow morning when i'm at breakfast my main thing that i'm like having trouble with are like with the dude he are in my entryway where are pretty sure where he like straight but also have no idea we was talk 'cause there are so many signs especially today so like knew that he was going to that he was having his um tracked meet so said um said to him like good luck on your track meet um unless you're still injured and you can't run then get better soon and so he did the the heart react on the good luck on the track meet and then he said thanks baby so was like hmm that little gay so what the truth and then later we um was talking can't remember there was something else that happened and then was talking to him went to get some sushi with my friends tonight and talked to him and was like yeah it sushi place and he was like oh i've never been there we should go some time and was like hmm okay gay so don't know if he just like extremely friendly and he like one-on-one hanging out with me and just calls like all of his other straight friends baby and like heart-reacts him and stuff but also have no idea and don't know what to do about that situation and with the guy that was talking to who lives he lives in [redacted] he um go to school downtown um uh um so he had been like basically ignoring me since thursday and then all of sudden tonight he and he came to [redacted] too and he didn't like text me or anything um and oh that the thing are told told my my the the air quote straight guy and he was like he don't deserve you and having your fun and loving energy and was like hmm okay but um then he called me and he was talking and was like yeah sorry just had like really busy weekend and so understand that and know that he talking to me again but also he if he wants to pursue something then he needs to actually put effort into it and i'm not gonna be going through this every single weekend he going out with friends like don't wants somebody who one cancels on me all the time and then two don't text me or even if he comes to [redacted] he don't even say oh hey i'm in [redacted] don't have any time to meet up but was just thinking about you don't know something random like that don't understand how that so hard so really [inaudible] talking later if thing continue like that um but also wants to pursue this other guy and like see where it go 
153,so today was um it it was weird day started off with my gov class and it was great lecture really um think i'm gonna really like that class it difficult but it not like it um mentally it it gonna be challenging class to like grasp and kind of understand like the professor was super great but think like the content just needs your own deep thinking and understanding which is gonna be something cool that but something that definitely needs to work on um but with my fam it weird because there guy that from the very beginning of the semester the fall semester that had falling out with and was i'm actually like uncomfortable in in class with him so i'm gonna talk to my advisor about that and be like yo what do we do because was thinking about it and he was so manipulative that it was borderline sexual harassment and didn't realize how much on top of him just being racist and problematic and didn't kind of really realize how big of deal it was um but had great day at work sitting there for four hours had like had stuff to do but also had time to do some reading which was really helpful and then went to the gym and went to my entryway meeting where we had sushi and pizza which was nice and then did some more homework with the guy who lives next door to me who i'm like aware he straight but also at the same time like don't think he is and there was few things and i'm definitely overthinking this but it just like triggered some thought so the first things texted him and was like yo wanna do homework together and like he was like yeah said your room and he was like yeah but wait like little bit because this other people is here in the room right now and like yeah okay but then was like if i'm friends with him too 'cause it was also people in my entryway so i'm like why wouldn't he just say come over now we can all hang out like he just wants me to be be there with him alone so i'm like hmm what going on but he just wanted to be alone and then when there we're there and talking and stuff and we was talking but we was also doing homework so we was being productive and then we started like watching some youtube videos together which was kind of fun um but then as when first got there he put his hand on my shoulder and was like hey and was like hey but then when left put my hand on his shoulder and then he put his hand on my hand he said good night sweet prince and then like made some little comment about him like that was like don't know just leave it at that and like don't know it weird so i'm gonna talk to my advisor about that and then i'm also gonna talk to my proctor about that 'cause don't know what he think should do 'cause he also gay so like don't know maybe he'll say to shoot my shot 
